{
  "$schema": "https://json-schema.org/draft/2020-12/schema",
  "$id": "https://raw.githubusercontent.com/smeshko/sail/main/schemas/sail.run.v1.json",
  "title": "sail run header: what was asked",
  "description": "run.json: written once at run start and never changed. The source, the workflow and its hash, the roster (the intake and each stage with its origin, permissions and budget), the run budget, and the sail version and adapters in use.",
  "type": "object",
  "properties": {
    "schema": { "const": "sail.run.v1" },
    "runId": { "type": "string" },
    "source": {
      "description": "what the run was started from, a ticket or a pull request; intake resolves it into the input",
      "type": "object",
      "required": ["kind"],
      "if": { "properties": { "kind": { "const": "pr" } }, "required": ["kind"] },
      "then": { "$ref": "#/$defs/prSource" },
      "else": { "$ref": "#/$defs/ticketSource" }
    },
    "fromRun": { "description": "the run a seeded run reused calls from", "type": "string", "minLength": 1 },
    "claim": {
      "description": "written only by runs from before the claim moved into the intake: whether the claim took, and the state the provider reported after sail's move. A newer run records its claim in intake#1's result.json",
      "type": "object",
      "properties": {
        "claimed": { "type": "boolean" },
        "state": { "$ref": "#/$defs/ticketState" }
      },
      "required": ["claimed", "state"],
      "additionalProperties": false
    },
    "workflow": {
      "type": "object",
      "properties": {
        "name": { "type": "string" },
        "version": { "type": "integer" },
        "origin": { "$ref": "#/$defs/origin" },
        "sha256": { "type": "string", "pattern": "^[0-9a-f]{16,64}$" }
      },
      "required": ["name", "version"],
      "additionalProperties": false
    },
    "branch": {
      "description": "the run's branch: the one its lease is keyed by and its steps push, named once at the start",
      "type": "string",
      "minLength": 1
    },
    "repository": {
      "description": "the repository the run's workspace was made from: the remote's URL without credentials, its default branch, and the base the workspace started at",
      "type": "object",
      "properties": {
        "url": { "type": "string" },
        "defaultBranch": { "type": "string" },
        "baseSha": { "type": "string", "pattern": "^[0-9a-f]{40}$" }
      },
      "required": ["url", "defaultBranch", "baseSha"],
      "additionalProperties": false
    },
    "workspace": { "description": "the run's workspace, relative to the run directory", "type": "string" },
    "sail": {
      "type": "object",
      "properties": {
        "version": { "type": "string" },
        "runtime": { "type": "string" }
      },
      "required": ["version", "runtime"],
      "additionalProperties": false
    },
    "adapters": {
      "description": "which adapter filled each port for this run",
      "type": "object",
      "properties": {
        "ticketSource": { "$ref": "#/$defs/adapterEntry" },
        "codeHost": { "$ref": "#/$defs/adapterEntry" },
        "harness": { "$ref": "#/$defs/adapterEntry" },
        "workspace": { "$ref": "#/$defs/adapterEntry" },
        "harnesses": {
          "description": "the named harnesses the run reached: name → adapter; absent when it reached none",
          "type": "object",
          "minProperties": 1,
          "additionalProperties": { "$ref": "#/$defs/adapterEntry" }
        }
      },
      "required": ["ticketSource", "codeHost", "harness", "workspace"],
      "additionalProperties": false
    },
    "intake": {
      "description": "the roster's intake: journaled as intake#1, never a stage",
      "$ref": "#/$defs/intakeEntry"
    },
    "stages": {
      "description": "the roster's stages: stage name → frozen definition; kinds belong to steps (a single-step stage carries its one step's kind, a multi-step stage carries steps[])",
      "type": "object",
      "patternProperties": { ".": { "$ref": "#/$defs/rosterEntry" } },
      "additionalProperties": false
    },
    "budget": { "$ref": "#/$defs/runBudget" },
    "startedAt": { "$ref": "#/$defs/ts" },
    "note": { "type": "string" }
  },
  "required": ["schema", "runId", "source", "workflow", "sail", "adapters", "intake", "stages", "startedAt"],
  "additionalProperties": false,
  "$defs": {
    "forced": {
      "description": "the checks --force overrode: empty for a run nobody forced",
      "type": "array",
      "items": { "enum": ["designation", "state"] },
      "uniqueItems": true
    },
    "ticketSource": {
      "type": "object",
      "properties": {
        "kind": { "const": "ticket" },
        "ticketKey": { "type": "string" },
        "via": { "enum": ["cli", "watch"] },
        "forced": { "$ref": "#/$defs/forced" }
      },
      "required": ["kind", "ticketKey", "via", "forced"],
      "additionalProperties": false
    },
    "prSource": {
      "description": "a pull request by its number, at the full head sha the run is for",
      "type": "object",
      "properties": {
        "kind": { "const": "pr" },
        "number": { "type": "integer", "minimum": 1 },
        "headSha": { "type": "string", "pattern": "^[0-9a-f]{40}$" },
        "via": { "enum": ["cli", "watch"] },
        "forced": { "$ref": "#/$defs/forced" }
      },
      "required": ["kind", "number", "headSha", "via", "forced"],
      "additionalProperties": false
    },
    "ts": { "type": "string", "pattern": "^\\d{4}-\\d{2}-\\d{2}T\\d{2}:\\d{2}:\\d{2}(\\.\\d+)?Z$" },
    "origin": { "type": "string", "pattern": "^(builtin|repo:.+)$" },
    "ticketState": {
      "description": "a ticket's state by type, with the provider's own name for it",
      "type": "object",
      "properties": {
        "type": { "enum": ["unstarted", "started", "completed", "canceled"] },
        "name": { "type": "string" }
      },
      "required": ["type", "name"],
      "additionalProperties": false
    },
    "adapterEntry": {
      "type": "object",
      "properties": {
        "use": { "type": "string", "minLength": 1 },
        "origin": { "$ref": "#/$defs/origin" },
        "versions": {
          "description": "the provider libraries and tools the adapter ran with: name → version",
          "type": "object",
          "patternProperties": { ".": { "type": "string" } },
          "additionalProperties": false
        }
      },
      "required": ["use", "origin"],
      "additionalProperties": false
    },
    "runBudget": {
      "type": "object",
      "properties": {
        "maxUsd": { "type": "number", "minimum": 0 },
        "maxMinutes": { "type": "number", "minimum": 0 }
      },
      "minProperties": 1,
      "additionalProperties": false
    },
    "stepBudget": {
      "type": "object",
      "properties": {
        "maxTurns": { "type": "integer", "minimum": 1 },
        "maxUsd": { "type": "number", "minimum": 0 },
        "maxMinutes": { "type": "number", "minimum": 0 }
      },
      "additionalProperties": false
    },
    "conventions": {
      "description": "an agent step's own convention files, in place of project.yaml's; none when empty",
      "type": "array",
      "items": { "type": "string", "minLength": 1 },
      "uniqueItems": true
    },
    "permissions": {
      "type": "object",
      "properties": {
        "read": { "type": "array", "items": { "type": "string" } },
        "write": { "type": "array", "items": { "type": "string" } },
        "commands": { "type": "array", "items": { "type": "string" } },
        "deny": { "type": "array", "items": { "type": "string" } },
        "network": {
          "oneOf": [{ "const": "none" }, { "type": "array", "items": { "type": "string" } }]
        },
        "tools": { "type": "array", "items": { "type": "string", "minLength": 1 } }
      },
      "additionalProperties": false
    },
    "exitCodes": {
      "type": "object",
      "patternProperties": { "^(passed|failed|error)$": { "type": "array", "items": { "type": "integer" } } },
      "additionalProperties": false
    },
    "intakeEntry": {
      "description": "a roster entry plus the intake's name",
      "type": "object",
      "properties": {
        "name": { "type": "string", "minLength": 1 },
        "kind": { "enum": ["agent", "script"] },
        "origin": { "$ref": "#/$defs/origin" },
        "model": { "type": "string" },
        "harness": {
          "description": "the named harness the step's model alias names; absent for the default harness",
          "type": "string",
          "minLength": 1
        },
        "output": { "type": "string" },
        "produces": { "type": "array", "items": { "type": "string" } },
        "network": { "type": "array", "items": { "type": "string" } },
        "permissions": { "$ref": "#/$defs/permissions" },
        "exitCodes": { "$ref": "#/$defs/exitCodes" },
        "budget": { "$ref": "#/$defs/stepBudget" },
        "conventions": { "$ref": "#/$defs/conventions" },
        "steps": {
          "type": "array",
          "minItems": 2,
          "items": { "$ref": "#/$defs/stepRosterEntry" }
        }
      },
      "required": ["name", "origin"],
      "additionalProperties": false
    },
    "rosterEntry": {
      "type": "object",
      "properties": {
        "kind": { "enum": ["agent", "script"] },
        "origin": { "$ref": "#/$defs/origin" },
        "model": { "type": "string" },
        "harness": {
          "description": "the named harness the step's model alias names; absent for the default harness",
          "type": "string",
          "minLength": 1
        },
        "output": { "type": "string" },
        "produces": { "type": "array", "items": { "type": "string" } },
        "network": { "type": "array", "items": { "type": "string" } },
        "permissions": { "$ref": "#/$defs/permissions" },
        "exitCodes": { "$ref": "#/$defs/exitCodes" },
        "budget": { "$ref": "#/$defs/stepBudget" },
        "conventions": { "$ref": "#/$defs/conventions" },
        "steps": {
          "type": "array",
          "minItems": 2,
          "items": { "$ref": "#/$defs/stepRosterEntry" }
        }
      },
      "required": ["origin"],
      "additionalProperties": false
    },
    "stepRosterEntry": {
      "type": "object",
      "properties": {
        "step": { "type": "string" },
        "kind": { "enum": ["agent", "script"] },
        "model": { "type": "string" },
        "harness": {
          "description": "the named harness the step's model alias names; absent for the default harness",
          "type": "string",
          "minLength": 1
        },
        "output": { "type": "string" },
        "produces": { "type": "array", "items": { "type": "string" } },
        "permissions": { "$ref": "#/$defs/permissions" },
        "network": { "type": "array", "items": { "type": "string" } },
        "budget": { "$ref": "#/$defs/stepBudget" },
        "conventions": { "$ref": "#/$defs/conventions" }
      },
      "required": ["step", "kind"],
      "additionalProperties": false
    }
  }
}
