{
  "schema": "sail.run.v1",
  "runId": "FAKE-3-01M39H4ZW0S46MV303CFX3T4PY",
  "source": {
    "kind": "ticket",
    "ticketKey": "FAKE-3",
    "via": "cli",
    "forced": []
  },
  "claim": {
    "claimed": true,
    "state": {
      "type": "started",
      "name": "In Progress"
    }
  },
  "workflow": {
    "name": "ticket-to-pr",
    "version": 1,
    "origin": "repo:.sail/workflows/ticket-to-pr",
    "sha256": "3cf83e9ac10038c87c246384a0ab7d5132bcc5edbbf528de575d6827bd79bf73"
  },
  "sail": {
    "version": "0.0.0",
    "runtime": "bun 1.4.2"
  },
  "adapters": {
    "ticketSource": {
      "use": "fake",
      "origin": "builtin"
    },
    "codeHost": {
      "use": "fake",
      "origin": "builtin"
    },
    "harness": {
      "use": "fake",
      "origin": "builtin"
    },
    "workspace": {
      "use": "fake",
      "origin": "builtin"
    }
  },
  "intake": {
    "name": "ticket",
    "origin": "builtin",
    "output": "TicketInput",
    "produces": [
      "ticket.json",
      "brief.md"
    ]
  },
  "stages": {
    "describe": {
      "kind": "agent",
      "origin": "repo:.sail/workflows/ticket-to-pr/stages/describe",
      "model": "claude-sonnet-5",
      "output": "PrDescription",
      "produces": [
        "pr-body.md"
      ],
      "permissions": {
        "read": [
          "**"
        ],
        "write": [
          "$STAGE_OUT/**"
        ],
        "commands": [
          "git log *",
          "git diff *"
        ]
      },
      "budget": {
        "maxTurns": 20,
        "maxUsd": 1,
        "maxMinutes": 5
      }
    },
    "implement": {
      "kind": "agent",
      "origin": "repo:.sail/stages/implement",
      "model": "claude-sonnet-5",
      "output": "ChangeSet",
      "produces": [
        "diff.patch"
      ],
      "permissions": {
        "read": [
          "**"
        ],
        "write": [
          "src/**",
          "test/**",
          "$STAGE_OUT/**"
        ],
        "commands": [
          "bun test*",
          "git add *",
          "git commit *",
          "git diff *"
        ]
      },
      "budget": {
        "maxTurns": 60,
        "maxUsd": 5,
        "maxMinutes": 20
      }
    },
    "lint": {
      "kind": "script",
      "origin": "repo:.sail/stages/lint",
      "output": "LintReport",
      "produces": [
        "lint.txt"
      ],
      "exitCodes": {
        "passed": [
          0
        ],
        "failed": [
          1
        ]
      }
    },
    "open": {
      "kind": "script",
      "origin": "repo:.sail/workflows/ticket-to-pr/stages/open",
      "output": "PrInfo",
      "exitCodes": {
        "passed": [
          0
        ],
        "failed": []
      }
    },
    "self-review": {
      "kind": "agent",
      "origin": "repo:.sail/workflows/ticket-to-pr/stages/self-review",
      "model": "claude-opus-5-5",
      "output": "ReviewOutput",
      "produces": [
        "review.md"
      ],
      "permissions": {
        "read": [
          "**"
        ],
        "write": [
          "$STAGE_OUT/**"
        ],
        "commands": [
          "git log *",
          "git diff *"
        ]
      },
      "budget": {
        "maxTurns": 30,
        "maxUsd": 2,
        "maxMinutes": 10
      }
    },
    "spec": {
      "kind": "agent",
      "origin": "repo:.sail/workflows/ticket-to-pr/stages/spec",
      "model": "claude-opus-5-5",
      "output": "SpecOutput",
      "produces": [
        "spec.md"
      ],
      "permissions": {
        "read": [
          "**"
        ],
        "write": [
          "$STAGE_OUT/**"
        ],
        "commands": [
          "git log *",
          "git diff *"
        ]
      },
      "budget": {
        "maxTurns": 40,
        "maxUsd": 2,
        "maxMinutes": 10
      }
    },
    "tests": {
      "kind": "script",
      "origin": "repo:.sail/stages/tests",
      "output": "TestReport",
      "produces": [
        "junit.xml"
      ],
      "exitCodes": {
        "passed": [
          0
        ],
        "failed": [
          1
        ]
      }
    }
  },
  "budget": {
    "maxUsd": 1,
    "maxMinutes": 90
  },
  "startedAt": "2026-09-24T11:00:00.000Z",
  "branch": "sail/FAKE-3-escape-b-this-b-that",
  "repository": {
    "url": "fake://origin",
    "defaultBranch": "main",
    "baseSha": "4203211311dad98c507528d05a25fff53b821b31"
  },
  "workspace": "workspace"
}
